{"schema_version":"local-monitor-comparison-rows.response.v1","comparison_id":"018f0000-0000-7000-8000-000000000010","family":"tool","items":[{"result_ordinal":20,"row_key":"tool.synthetic","display_name":"Synthetic tool","values":[{"key":"a_session_count","state":"recorded","value":"1"},{"key":"a_available_count","state":"recorded","value":"1"},{"key":"a_called_session_count","state":"recorded","value":"1"},{"key":"a_call_count","state":"recorded","value":"1"},{"key":"b_session_count","state":"recorded","value":"1"},{"key":"b_available_count","state":"recorded","value":"1"},{"key":"b_called_session_count","state":"recorded","value":"1"},{"key":"b_call_count","state":"recorded","value":"2"},{"key":"called_session_count_absolute_difference","state":"explicit_zero","value":"0"},{"key":"call_count_absolute_difference","state":"recorded","value":"1"}]}],"next_cursor":null}